Sheet: pcb_esp32_wled_pwm_multichannel
A1: Description | B1: Part | C1: References | D1: Description | E1: Part | F1: References | G1: Value | H1: Footprint | I1: Quantity Per PCB | J1: MF | K1: MP | L1: Distributor | M1: LCSC | N1: SMD | O1: TH | P1: Vf | Q1: If | R1: DNF
A2: Unpolarized capacitor | B2: C | C2: C102 C105 C107 C108 C109 C110 C111 C115 C118 | D2: Unpolarized capacitor | E2: C | F2: C102 C105 C107 C108 C109 C110 C111 C115 C118 | G2: 100nF/50V | H2: C_0603_1608Metric | I2: 9 | J2: FH | K2: 0603F104M500NT | L2: LCSC | M2: C42998 | N2: 1
A3: Polarized capacitor | B3: C_Polarized | C3: C116 | D3: Polarized capacitor | E3: C_Polarized | F3: C116 | G3: 100µF/50V | H3: CP_Elec_6.3x7.7 | I3: 1 | J3: Lelon | K3: VZT101M1HTR-0607 | L3: LCSC | M3: C311622 | N3: 1
A4: Unpolarized capacitor | B4: C | C4: C104 | D4: Unpolarized capacitor | E4: C | F4: C104 | G4: 10µF/25V | H4: C_0805_2012Metric | I4: 1 | J4: FH | K4: 0805X106K250NT | L4: LCSC | M4: C40894 | N4: 1
A5: Unpolarized capacitor | B5: C | C5: C103 | D5: Unpolarized capacitor | E5: C | F5: C103 | G5: 1µF/50V | H5: C_0603_1608Metric | I5: 1 | J5: Taiyo Yuden | K5: UMK107AB7105KA-T | L5: LCSC | M5: C105174 | N5: 1
A6: Unpolarized capacitor | B6: C | C6: C101 | D6: Unpolarized capacitor | E6: C | F6: C101 | G6: 220µF/6.3V(20%) | H6: C_1206_3216Metric | I6: 1 | J6: Murata Electronics | K6: GRM31CR60J227ME11L | L6: LCSC | M6: C412252 | N6: 1
A7: Unpolarized capacitor | B7: C | C7: C112 C113 | D7: Unpolarized capacitor | E7: C | F7: C112 C113 | G7: 22uF/25V(10%) | H7: C_1210_3225Metric | I7: 2 | J7: Taiyo Yuden | K7: TMK325B7226KM-TR | L7: LCSC | M7: C337455 | N7: 1
A8: Polarized capacitor | B8: C_Polarized | C8: C117 | D8: Polarized capacitor | E8: C_Polarized | F8: C117 | G8: 330µF/6.3V | H8: CP_Elec_6.3x7.7 | I8: 1 | J8: RVT0J331M0607 | K8: ROQANG | L8: LCSC | M8: C74623 | N8: 1
A9: Unpolarized capacitor | B9: C | C9: C114 | D9: Unpolarized capacitor | E9: C | F9: C114 | G9: 4.7µF/6.3V(10%) | H9: C_0603_1608Metric | I9: 1 | N9: 1
A10: 40V 1A Schottky Barrier Rectifier Diode, DO-41 | B10: 1N5819 | C10: D118 | D10: 40V 1A Schottky Barrier Rectifier Diode, DO-41 | E10: 1N5819 | F10: D118 | G10: 1N5819 | H10: D_DO-41_SOD81_P10.16mm_Horizontal | I10: 1 | N10: 0 | O10: 1
A11: Schottky diode | B11: D_Schottky | C11: D101 D102 D103 D104 D105 D106 D107 D108 D109 D110 D111 D112 D114 | D11: Schottky diode | E11: D_Schottky | F11: D101 D102 D103 D104 D105 D106 D107 D108 D109 D110 D111 D112 D114 | G11: D_Schottky | H11: D_SOD-123F | I11: 13 | J11: Shanghai Prisemi Elec | K11: PSBD1DF40V2L | L11: LCSC | M11: C496544 | N11: 1
A12: Light emitting diode | B12: LED | C12: D113 | D12: Light emitting diode | E12: LED | F12: D113 | G12: GREEN_LED | H12: LED_0603_1608Metric | I12: 1 | J12: Foshan NationStar Optoelectronics | K12: NCD0603C3 | L12: LCSC | M12: C89809 | N12: 1 | O12: 0 | P12: 1.6V | Q12: 25mA
A13: Bidirectional transient-voltage-suppression diode | B13: D_TVS | C13: D115 D116 D117 | D13: Bidirectional transient-voltage-suppression diode | E13: D_TVS | F13: D115 D116 D117 | G13: LESD5D5.0CT1G | H13: D_SOD-523 | I13: 3 | J13: LRC | K13: LESD5D5.0CT1G | L13: LCSC | M13: C383211 | N13: 1 | O13: 0
A14: Generic connector, single row, 01x02, script generated (kicad-library-utils/schlib/autogen/connector/) | B14: Conn_01x02_Female | C14: J108 | D14: Generic connector, single row, 01x02, script generated (kicad-library-utils/schlib/autogen/connector/) | E14: Conn_01x02_Female | F14: J108 | G14: Conn_01x02_Female | H14: 2EDGRC-5.08-02P-14-100AH | I14: 1 | J14: Ningbo Kangnex Elec | K14: WJ2EDGRC-5.08-2P | L14: LCSC | M14: C3697 | N14: 0 | O14: 1
A15: Generic connector, single row, 01x03, script generated (kicad-library-utils/schlib/autogen/connector/) | B15: Conn_01x03_Female | C15: J106 J107 | D15: Generic connector, single row, 01x03, script generated (kicad-library-utils/schlib/autogen/connector/) | E15: Conn_01x03_Female | F15: J106 J107 | G15: Conn_01x03_Female | H15: PinSocket_1x03_P2.54mm_Vertical | I15: 2 | J15: generic | K15: PinHeader,Feamle,P=2.54mm,3Pin,1Row,1A | L15: LCSC | M15: C358717 | N15: 0 | O15: 1
A16: USB 2.0-only Type-C Receptacle connector | B16: USB_C_Receptacle_USB2.0 | C16: J109 | D16: USB 2.0-only Type-C Receptacle connector | E16: USB_C_Receptacle_USB2.0 | F16: J109 | G16: USB_C_Receptacle_USB2.0 | H16: USB_C_Receptacle_CIKI_TYPE-C-2.0-16PIN-SMT-3 | I16: 1 | J16: CIKI | K16: TYPE-C-2.0-16PIN-SMT-3 | L16: LCSC | M16: C2987386 | N16: 1 | O16: 0
A17: Generic connector, single row, 01x04, script generated (kicad-library-utils/schlib/autogen/connector/) | B17: Conn_01x04_Female | C17: J101 J102 J103 J104 | D17: Generic connector, single row, 01x04, script generated (kicad-library-utils/schlib/autogen/connector/) | E17: Conn_01x04_Female | F17: J101 J102 J103 J104 | G17: WJ2EDGRC-5.08-4P | H17: 2EDGRC-5.08-04P-14-100AH | I17: 4 | J17: Ningbo Kangnex Elec | K17: WJ2EDGRC-5.08-4P | L17: LCSC | M17: C8446 | N17: 0 | O17: 1
A18: Inductor | B18: L | C18: L101 | D18: Inductor | E18: L | F18: L101 | G18: 330µH | H18: L_12x12mm_H8mm | I18: 1 | J18: SHOU HAN | K18: CYH127-330UH | L18: LCSC | M18: C2929508 | N18: 1
A19: 62A Id, 30V Vds, 8.7 mOhm Rds, N-Channel HEXFET Power MOSFET, TO-220 | B19: IRLB8721PBF | C19: Q101 Q102 Q103 Q104 Q105 Q106 Q107 Q108 Q109 Q110 Q111 Q112 | D19: 62A Id, 30V Vds, 8.7 mOhm Rds, N-Channel HEXFET Power MOSFET, TO-220 | E19: IRLB8721PBF | F19: Q101 Q102 Q103 Q104 Q105 Q106 Q107 Q108 Q109 Q110 Q111 Q112 | G19: IRLR8743TRPBF | H19: TO-252-2 | I19: 12 | J19: Infineon Technologies | K19: IRLR8743TRPBF | L19: LCSC | M19: C3040285 | N19: 1 | O19: 0
A20: NPN Darlington transistor, base/emitter/collector | B20: Q_NPN_Darlington_BEC | C20: Q113 Q114 | D20: NPN Darlington transistor, base/emitter/collector | E20: Q_NPN_Darlington_BEC | F20: Q113 Q114 | G20: Q_NPN_Darlington_BEC | H20: SOT-23 | I20: 2 | J20: JIANGSU CHANGJIANG ELECTRONICS | K20: SS8050 | L20: LCSC | M20: C164885 | N20: 1
A21: Resistor | B21: R | C21: R114 R117 R118 R121 | D21: Resistor | E21: R | F21: R114 R117 R118 R121 | G21: 10K(5%) | H21: R_0603_1608Metric | I21: 4 | N21: 1
A22: Resistor | B22: R | C22: R123 R124 | D22: Resistor | E22: R | F22: R123 R124 | G22: 22(1%) | H22: R_0603_1608Metric | I22: 2 | N22: 1
A23: Resistor | B23: R | C23: R122 | D23: Resistor | E23: R | F23: R122 | G23: 22K(1%) | H23: R_0603_1608Metric | I23: 1 | N23: 1
A24: Resistor | B24: R | C24: R119 | D24: Resistor | E24: R | F24: R119 | G24: 2K(5%) | H24: R_0603_1608Metric | I24: 1 | N24: 1 | O24: 0
A25: Resistor | B25: R | C25: R120 | D25: Resistor | E25: R | F25: R120 | G25: 47K(5%) | H25: R_0603_1608Metric | I25: 1 | N25: 1
A26: Resistor | B26: R | C26: R125 R126 | D26: Resistor | E26: R | F26: R125 R126 | G26: 5k1 (5%) | H26: R_0603_1608Metric | I26: 2 | N26: 1 | O26: 0
A27: Resistor | B27: R | C27: R113 | D27: Resistor | E27: R | F27: R113 | G27: 68Ω/1% | H27: R_0603_1608Metric | I27: 1 | J27: YAGEO | K27: RC0603FR-0768RL | L27: LCSC | M27: C126362 | N27: 1 | O27: 0
A28: Resistor | B28: R | C28: R101 R102 R103 R104 R105 R106 R107 R108 R109 R110 R111 R112 | D28: Resistor | E28: R | F28: R101 R102 R103 R104 R105 R106 R107 R108 R109 R110 R111 R112 | G28: 91(1%) | H28: R_0603_1608Metric | I28: 12 | N28: 1
A29: Push button switch, generic, two pins | B29: SW_Push | C29: SW101 SW102 | D29: Push button switch, generic, two pins | E29: SW_Push | F29: SW101 SW102 | G29: SW_Push | H29: SW_SPST_B3SL-1022P | I29: 2 | J29: Omron Electronics | K29: B3SL-1022P | L29: LCSC | M29: C86708 | N29: 1
A30: USB to UART master bridge, QFN-24 | B30: CP2102N-Axx-xQFN24 | C30: U103 | D30: USB to UART master bridge, QFN-24 | E30: CP2102N-Axx-xQFN24 | F30: U103 | G30: CP2102N-Axx-xQFN24 | H30: QFN-24-1EP_4x4mm_P0.5mm_EP2.6x2.6mm | I30: 1 | J30: Silicon Labs | K30: CP2102N-A02-GQFN24R | L30: LCSC | M30: C969151 | N30: 1 | O30: 0
A31: RF Module, ESP32-D0WDQ6 SoC, Wi-Fi 802.11b/g/n, Bluetooth, BLE, 32-bit, 2.7-3.6V, onboard antenna, SMD | B31: ESP32-WROOM-32 | C31: U101 | D31: RF Module, ESP32-D0WDQ6 SoC, Wi-Fi 802.11b/g/n, Bluetooth, BLE, 32-bit, 2.7-3.6V, onboard antenna, SMD | E31: ESP32-WROOM-32 | F31: U101 | G31: ESP32-WROOM-32U | H31: ESP32-WROOM-32U | I31: 1 | J31: Espressif | K31: ESP32-WROOM-32U | L31: LCSC | M31: C328062 | N31: 1
A32: Fixed 3.3V 52kHz Simple 1A Buck Regulator, TO-263 | B32: LM2575-3.3BU | C32: U102 | D32: Fixed 3.3V 52kHz Simple 1A Buck Regulator, TO-263 | E32: LM2575-3.3BU | F32: U102 | G32: LM2575-3.3BU | H32: TO-263-5_TabPin3 | I32: 1 | J32: onsemi | K32: LM2575D2T-3.3R4G | L32: LCSC | M32: C70337 | N32: 1
H37: of:=COUNT([.I2:.I33]) -> 31 | I37: of:=SUM([.I2:.I32]) -> 87 | N37: of:=SUM([.N2:.N36]) -> 27 | O37: of:=SUM([.O2:.O36]) -> 4
A40: Number of unique Parts: | B40: of:=[.H37] -> 31
A41: Fitted Components: | B41: of:=[.I37] -> 87
A42: Number SMD Parts | B42: of:=[.N37] -> 27
A43: Number TH Parts | B43: of:=[.O37] -> 4
A44: Number BGA Parts | B44: 0